{
  "metadata": {
    "description": "Plugin marketplace for making codebases ready for autonomous AI development",
    "version": "0.1.0"
  },
  "name": "cairn",
  "owner": {
    "name": "krokoko"
  },
  "plugins": [
    {
      "category": "Assessment",
      "description": "Assess how AI-friendly a codebase is and produce an autonomy maturity map",
      "keywords": ["readiness", "assessment", "maturity", "autonomy-levels", "diagnosis"],
      "name": "codebase-ai-readiness",
      "source": "./plugins/codebase-ai-readiness",
      "tags": ["autonomy", "readiness", "assessment", "agents"],
      "version": "0.5.0"
    },
    {
      "category": "Verification",
      "description": "Design verification strategies that unlock higher levels of autonomous software development",
      "keywords": ["verification", "testing", "formal-methods", "oracles", "strategy"],
      "name": "software-verification",
      "source": "./plugins/software-verification",
      "tags": ["autonomy", "verification", "testing", "agents"],
      "version": "0.6.0"
    }
  ]
}
